{
  "$schema": "https://json-schema.org/draft/2020-12/schema",
  "$id": "https://rightsroot.org/spec/prm/schemas/prm-response-v1.schema.json",
  "title": "PRM Response Record v1",
  "description": "A signed record that the issuer received (or did not receive) a response to a notice. PRM PRESERVES the response; it does not evaluate it. The status is the issuer's own characterisation, and carries no assertion that the recipient's legal position is right or wrong. Digest = SHA-256(JCS(doc minus 'id' and 'proof')); signature domain prefix 'PRM-RESPONSE-v1\\u0000'.",
  "type": "object",
  "required": ["@context", "type", "noticeDigest", "status", "recorded", "proof"],
  "additionalProperties": false,
  "properties": {
    "@context": {
      "type": "array",
      "prefixItems": [
        { "const": "https://www.w3.org/ns/credentials/v2" },
        { "const": "https://rightsroot.org/spec/prm/ns/v1" }
      ],
      "items": { "type": "string", "format": "uri" }
    },
    "type": { "type": "array", "contains": { "const": "PRMResponseRecord" }, "items": { "type": "string" } },
    "id": { "type": "string", "pattern": "^urn:prm:response:u[A-Za-z0-9_-]{40,}$" },

    "noticeDigest": { "$ref": "#/$defs/multihash" },
    "deliveryDigest": { "$ref": "#/$defs/multihash" },

    "recipient": {
      "type": "object",
      "required": ["name"],
      "additionalProperties": false,
      "properties": {
        "name": { "type": "string", "minLength": 1, "maxLength": 256 },
        "id": { "type": "string" },
        "domain": { "type": "string" },
        "contact": { "type": "string" }
      }
    },

    "status": {
      "enum": ["acknowledged", "accepted", "partially-accepted", "declined", "no-response", "superseded"],
      "description": "The ISSUER'S characterisation of what came back. Not an adjudication, and PRM attaches no legal meaning to it."
    },
    "receivedAt": {
      "$ref": "#/$defs/utcInstant",
      "description": "Omitted for status 'no-response', where nothing arrived to date."
    },
    "recorded": { "$ref": "#/$defs/utcInstant" },

    "responseDigest": {
      "$ref": "#/$defs/multihash",
      "description": "Digest of the recipient's actual response, if one was received and preserved. The artifact itself stays private unless the issuer chooses otherwise."
    },
    "responseMediaType": { "type": "string", "maxLength": 128 },
    "notes": {
      "type": "string",
      "maxLength": 8000,
      "description": "The issuer's own words about the response. PRM does not interpret them."
    },

    "proof": { "$ref": "https://rightsroot.org/spec/prm/schemas/prm-policy-v1.schema.json#/$defs/dataIntegrityProof" }
  },
  "allOf": [
    {
      "if": { "properties": { "status": { "const": "no-response" } }, "required": ["status"] },
      "then": { "not": { "required": ["receivedAt"] } },
      "else": { "required": ["receivedAt"] }
    }
  ],
  "$defs": {
    "multihash": { "type": "string", "pattern": "^u[A-Za-z0-9_-]{40,}$" },
    "utcInstant": { "type": "string", "pattern": "^\\d{4}-\\d{2}-\\d{2}T\\d{2}:\\d{2}:\\d{2}Z$" }
  }
}
