{
  "@context": [
    "https://www.w3.org/ns/credentials/v2",
    "https://rightsroot.org/spec/prm/ns/v1"
  ],
  "type": [
    "VerifiableCredential",
    "PRMResponseRecord"
  ],
  "noticeDigest": "uEiC5IVcL4rLIEItGi5JPCBeTyfp__1e7h9yL3Z_vJO3tRg",
  "deliveryDigest": "uEiDlNIKixXUb-zlvksppHXRGyPnP47Itkcrq_kyIoxK7Yw",
  "recipient": {
    "name": "City of Whittier Police Department"
  },
  "status": "acknowledged",
  "receivedAt": "2026-09-24T15:00:00Z",
  "recorded": "2026-09-24T16:00:00Z",
  "notes": "Placeholder: receipt acknowledged, no position stated on the individual objections.",
  "proof": {
    "type": "DataIntegrityProof",
    "cryptosuite": "eddsa-jcs-2022",
    "created": "2026-09-24T16:00:00Z",
    "verificationMethod": "did:key:z6MkfCwPTWq3SKbw4AVj7j8t8oFBiFp6CvZiTnXAw24nVkLH#z6MkfCwPTWq3SKbw4AVj7j8t8oFBiFp6CvZiTnXAw24nVkLH",
    "proofPurpose": "assertionMethod",
    "proofValue": "z2BWSF2efWCGXfUSVsehTVvT3fNor1XTnjxEhnN1p6qFsDjp5rWBbHJZyZmL2uhFqQEQ4iQNiLe1E75LV7vKWyaUw"
  },
  "id": "urn:prm:response:uEiDFeTKTXvK8dDuBd3ND7SpnlD7Ntx-b17MRA8TArvc_Aw"
}